<?xml version="1.0" encoding="utf-8"?>

<!DOCTYPE clinic [
        <!ELEMENT clinic (stuff)*>
        <!ELEMENT stuff (fio,position,department,experience)>
        <!ELEMENT fio (#PCDATA)>
        <!ELEMENT position (#PCDATA)>
        <!ELEMENT department (#PCDATA)>
        <!ELEMENT experience (#PCDATA)>
        ]>

<clinic xmlns:xsi="http://www.w3.org/2001/XMLSchema-instance" xsi:noNamespaceSchemaLocation="medicalclinic2.xsd">
    <stuff>
        <name>Gregory House</name>
        <position>Head of department</position>
        <department>Diagnostic medicine</department>
        <experience>27</experience>
    </stuff>
    <stuff>
        <name>Robert Chase</name>
        <position>Doctor</position>
        <department>Diagnostic medicine</department>
        <experience>10</experience>
    </stuff>
    <stuff>
        <name>James Wilson</name>
        <position>Head of department</position>
        <department>Cancer diagnostic</department>
        <experience>23</experience>
    </stuff>
    <stuff>
        <name>Allison Cameron</name>
        <position>Doctor</position>
        <department>Diagnostic medicine</department>
        <experience>12</experience>
    </stuff>
</clinic>